{
  "schemaVersion": 1,
  "workId": "uncanny",
  "sectionId": "uncanny-valley-and-double",
  "sectionOrder": 1,
  "title": "The Uncanny Valley and the Uncanny Double",
  "editionId": "editorial-preview",
  "versionId": "uncanny-valley-and-double-editorial-v001",
  "parentVersionId": null,
  "createdAt": "2026-09-23T00:00:00Z",
  "source": {
    "type": "authored",
    "path": "uncanny/source_texts/sections/section-1.md"
  },
  "spine": [
    {
      "id": "uncanny-valley-and-double-p01",
      "markdown": "# VR, Film, and the Far Side of the Uncanny Valley\nJay Bolter and Maria Engberg\n\n**Abstract:**\n\nVR is often promoted as the ultimate medium in its capacity to imitate or indeed replace reality. In this respect VR is implicitly or explicitly compared to film. In particular, VR's goal of photorealism makes it clear how those who develop digital technologies and applications are influenced by the aesthetics and cultural role of mainstream film in the twentieth century. In the quest for photorealism, computer scientists and CG artists refer to the task of crossing the \"uncanny valley,\" a term coined by roboticist Masahiro Mori. The claim is that as CG strives to create increasingly realistic 3D humans and animals, the figures become less rather than more sympathetic. The effect is eerie or uncanny, because the viewer becomes increasingly aware of the gap between the figures and authentic living beings. We propose to examine the uncanny valley in CG in the context of the history of the uncanny doubles in film. We argue that there is a clear continuity between this tradition and the uncanny doubles in digital media, such as avatars in VR. As a medium that depends entirely on CG for its visual expression, VR shares with or indeed inherits from film an ambivalence about its status as a medium. Both VR and mainstream film are technologies of illusion and yet both claim in some sense to reproduce or appropriate reality. The uncanny oscillation between illusion and reality is a key feature of the aesthetics of both film and digital media."
    },
    {
      "id": "uncanny-valley-and-double-p02",
      "markdown": "Virtual reality (VR) is often promoted as the ultimate medium in its capacity to reproduce or indeed replace reality. The representational techniques underlying VR as a reality medium are those of 3D computer graphics (3D CG). In the quest for photorealism, computer graphics artists and even some computer scientists refer to the task of crossing the \"uncanny valley,\" a term coined in the 1970s by a roboticist, Masahiro Mori (Mori et al., 2012 [1970]). Mori illustrated his concept with a graph in which \"human likeness\" is plotted on the x-axis and what was translated as \"affinity\" on the y-axis. He proposed that as robots become more human-like, our affinity for them increases, but only up to a point. Robots or artifacts (e.g. a prosthetic hand) that bear a close but not perfect resemblance to humans instead evoke a feeling of unease or uncanniness. Affinity plummets. As a robot or artifact achieves something closer to perfect realism, it moves back up the affinity curve. There is then an \"uncanny valley\" that roboticists could avoid either by staying in the realm of the not-very-human or by achieving a perfect resemblance to the human. Computer graphics borrowed the term from robotics, because realistic, but imperfect 3D CG humans and animals too can become less rather than more sympathetic."
    },
    {
      "id": "uncanny-valley-and-double-p03",
      "markdown": "The problem of the uncanny valley has been a concern for computer science and popular computer graphic art for decades. The computer science literature treats it as a psychological phenomenon relevant to human-computer interaction (Diehl et al., 2021; Kätsyri et al, 2015). The CG artists' community regards the uncanny valley as a practical problem. Although they do not necessarily acknowledge it, both artists and researchers understand the phenomenon of the uncanny valley in terms of the earlier media of photography and film. The far side of the valley would be realistic photography and live-action film. This is at least ostensibly different from robotics, where Mori's term originated, because robots are physical and operate in the physical world, alongside humans. In theory, the uncanny valley could describe the feeling of the uncanny produced by any 3D representation; a 3D landscape could be uncanny in this sense, in which case one could actually have an uncanny 3D valley. But the uncanny valley problem is almost always posed in the context of rendering human-like figures (and animals). It arises, then, that the challenge of CG is to recreate the human, or in other words, to make a human double. This is an ambition that CG shares with robotics."
    },
    {
      "id": "uncanny-valley-and-double-p04",
      "markdown": "Our focus in this paper will be on the uncanny valley as a question of aesthetics, not human-computer interaction or perceptual psychology. We explore the aesthetic assumptions and representational practices of CG artists and popular audiences because it is these assumptions and practices that connect CG (and its application in screen-based and headset VR) to the realistic traditions of \"mainstream\" cinema. We acknowledge that photorealism is not the whole story of CG and VR today, any more than the realism is the whole story of film. Many videogames and other digital experiences offer their players or viewers cartoon-like worlds that remain safely on the near side of the uncanny valley. There is also an important tradition of digital art using nonrealistic computer graphics that we do not consider here. However, the allure of the photorealistic and the \"real\" is still an important driver behind both technological and content development for VR experiences."
    },
    {
      "id": "uncanny-valley-and-double-p05",
      "markdown": "Specifically, we propose to examine the uncanny valley in CG in the context of the history of the uncanny and uncanny doubles in film. We begin with a look at the filmic tradition of the uncanny double. We then suggest that there is a clear continuity between this tradition with the uncanny doubles in digital media, such as avatars in VR and more recently AI generated imagery and even chatbots. We argue that VR shares with or indeed inherits from film an ambivalence about its status as a medium. Both VR and mainstream film are technologies of illusion and yet both claim in some sense to reproduce or appropriate reality. The uncanny oscillation between illusion and reality is a key feature of the aesthetics of both film and digital media."
    }
  ],
  "fundEntries": [],
  "changeSummary": "Faithful structural package of authored The Uncanny Section 1; no prose changes and no initial fund entries."
}
