{
  "schemaVersion": 1,
  "workId": "blood-on-the-wall",
  "sectionId": "files-break-open",
  "sectionOrder": 4,
  "title": "The Files Break Open",
  "editionId": "editorial-preview",
  "versionId": "files-break-open-editorial-v001",
  "parentVersionId": null,
  "createdAt": "2026-09-23T00:00:00Z",
  "source": {
    "type": "authored",
    "path": "blood-on-the-wall/source_texts/sections/section-4.md"
  },
  "spine": [
    {
      "id": "files-break-open-p01",
      "markdown": "When the East German state finally buckled in 1989, the crowds that breached the Wall in November did not stop at champagne and hammers. They marched on the Stasi's Normannenstraße headquarters demanding the assassination files specifically, tearing open filing cabinets that had been sealed for twenty-six years. What poured out — names, cables, half-answers about how much Ulbricht's superiors had known in 1963 — became the template other post-communist states would later borrow: public reckonings with secret-police archives as the price of legitimacy."
    },
    {
      "id": "files-break-open-p02",
      "markdown": "By 1993, reunified Germany maintains a standing Office for Stasi Records with international access unmatched by any other country's archive. Joint American-German counterintelligence units, born from 1960s cooperation, still operate. The assassination site in Berlin carries a permanent security perimeter and a memorial, and its anniversary draws heads of state each June. Yet the reckoning is incomplete: some officers escaped to Moscow or Latin America, the question of what the Kremlin knew remains legally and politically radioactive, and in Russia's own constitutional crisis that autumn, nationalist deputies denounce the whole affair as Western fabrication weaponized against Russian dignity. The Cold War has ended, but its founding wound in Berlin has not closed — only scarred over, publicly, imperfectly, in full view of the cameras."
    }
  ],
  "fundEntries": [],
  "changeSummary": "Faithful structural package of authored Blood on the Wall Section 4; no prose changes and no initial fund entries."
}
