{
  "schemaVersion": 1,
  "workId": "uncanny",
  "sectionId": "double-in-film",
  "sectionOrder": 3,
  "title": "The Double in Film",
  "editionId": "editorial-preview",
  "versionId": "double-in-film-editorial-v001",
  "parentVersionId": null,
  "createdAt": "2026-09-23T00:00:00Z",
  "source": {
    "type": "authored",
    "path": "uncanny/source_texts/sections/section-3.md"
  },
  "spine": [
    {
      "id": "double-in-film-p01",
      "markdown": "The fact that film itself can be received as an uncanny doubling of the world helps to explain why filmmakers have found the theme of doubling so appealing, especially in the genres of horror and detective film. Film's ambiguous status also explains the ambivalent way in which doubles are depicted—often as a source of revulsion or at least anxiety and fear, but also fascination."
    },
    {
      "id": "double-in-film-p02",
      "markdown": "In The Invasion of the Body Snatchers (1956), aliens are seeking to replace humans with their physical doubles. Each double develops in a pod until it is fully formed and ready to replace its target human. In an early scene Miles, the doctor, is called to his friend Jack's house to examine an inanimate pod that Jack and his wife have found. When they examine the body, they note that it resembles a human, and yet something is missing. Jack notes that \"It's like the first impression that's stamped on a coin. It isn't finished,\" and Miles agrees \"You're right, it has all the features but no details, no character, no lines.\" The pod, which is designed to replace Jack, is situated in the uncanny valley. Although the film offers only incidental glimpses of its face, Miles's description suggests that the pod is where CG modeling of humans was perhaps ten years ago, when CG faces lacked convincing lines and imperfections. More recently, characters in highly photorealistic video games, such as Ellie in The Last of Us II, look considerably more human, but they still lack an authentic sense of character, especially when in motion, for example, smiling, frowning, talking. The lack of emotion and therefore authenticity, is exactly the claim that (human) characters make in the Invasion of the Body Snatchers, when they describe relatives and friends who have already undergone replacement. They say that their husband, aunt, or best friend no longer seems to be the person that they knew, even though the physical resemblance is perfect. The motif of the loss of authenticity (we could say aura), is carried across all three of the remakes of the 1956 film as well: The Invasion of the Body Snatchers (1978), Body Snatchers (1993), and The Invasion (2007). It is the defining idea of all the films, the difference that the alien pods cannot erase."
    },
    {
      "id": "double-in-film-p03",
      "markdown": "Just as the Body Snatchers films are about the fear of replacement or substitution, replacement is quite explicit in Jordan Peele's US. Here too one double exists for each human subject, and one of these does ultimately succeed in replacing the main character. US realizes the metaphor of the repressed literally, as these doubles live underground, condemned to an empty life mimicking the actions of their twins above ground. We learn that they do not have their own soul, but must share the soul of their twin. They are othered, not fully human, and glimpses, late in the film, of their subterranean lives suggest that they are drained of their own affect, as in the Body Snatcher films—that is, until they break out and, at least in some cases, are prepared to brutally murder their doubles and take their place. They act out the danger that is implied in Freud's analyses of the fetish or of the uncanny."
    },
    {
      "id": "double-in-film-p04",
      "markdown": "The narratologist Todorov (1973) made a distinction between the fantastic and the uncanny. For Todorov, a narrative is uncanny if the events, while seeming supernatural, can ultimately be explained. The fantastic is the state of ambiguity between the uncanny and the marvelous, supernatural events that cannot be rationalized. But for our purposes, we would like to combine Todorov's categories of uncanny and fantastic, because what Todorov calls the fantastic, the hesitation between rational explanation and the miraculous, fits so well with the psychology of the uncanny and with the experience of filmic doubles. Horror and fantasy films involving doubles resolve the uncanny hesitation by abandoning rational explanation. Detective and mystery films go the other way. It is the detective's job is to find a rational explanation, typically by uncovering a hidden truth, and in that sense, the Freudian psychoanalyst is also a detective. Vertigo is a classic example in which the uncanny hesitation over the nature of the Madeleine/Judy double—a hesitation that almost costs the detective his sanity—eventually resolves in a rational, if tragic, conclusion."
    },
    {
      "id": "double-in-film-p05",
      "markdown": "In any genre, films that feature doubles who supplant human characters symbolically or in fact can be read as allegories for the possibility that film itself might be superseded by other media. The concern is both for the economic future of mainstream cinema and for the cultural impact. In the American context, Hollywood's insecurity in the face of new media technologies dates back at least to the advent of broadcast television in the 1950s, when film attendance did fall. In response the studios produced films in wide-screen formats and vivid color to emphasize that the movie theater offered an experience that could not be matched at home. In the 1990s, the rise in popularity and status of video games posed the first challenge from the new digital technologies. Hollywood film responded this time with a series of films that explore the dystopian threat of games (mostly represented as virtual reality games), including Lawnmower Man (1992), Strange Days (1995), ExistenZ (1999), and most famously the Matrix films (1999-2021). Eventually, Hollywood also made adaptations of some of the most popular (shooter) games into movies such as Tomb Raiders (2001) and Resident Evil (2002). As Shapiro (2016) and many others have noted, action-adventure films came to adopt aesthetic techniques of video games, particularly in their combat sequences, in which the main character kills one minor henchman after another with a rhythm borrowed from first-person shooters. At the same time, Hollywood has become more and more dependent on CG techniques, so that contemporary blockbusters are hybrids between traditional live action filming and game-studio like postproduction techniques. The uncanny valley problem arises precisely in these hybrids, as they strive to integrate CGI seamlessly into live action film. Hence, even while filmmakers were thematizing the danger of CG-based media, film studios came to embrace the visual techniques of video games in some of their most lucrative films."
    },
    {
      "id": "double-in-film-p06",
      "markdown": "Each of these technological innovations and their perceived threat reminds us of filmmakers' fundamental uncertainty about the status or film as a reality medium. That uncertainty is the product not only of their fear of film's replacement by a newer medium but also of the concern over the gap between film's representational capacity and the real world. Each new technology aims to fill that gap. It is important to remember that if the danger posed by some genres of video games and VR is that they threaten to blur the line between visual reality and illusion, then film itself was always liable to the same critique. Sensitive to this liability, filmmakers and the industry as a whole insist all the more adamantly on film's special claim to authenticity. As we are told every March at the Oscar ceremony, mainstream narrative films do not merely offer their viewers a faithful visual representation of reality; they depict \"real emotions\" and confront authentic human problems. Video games and VR have so far been unable to match film's historic claim to authenticity. Meanwhile, the number of both scholarly and popular articles dealing with the uncanny valley indicates that developers and computer scientists are equally concerned with the representational gap of the newer digital media that depend on CG. As we noted above, the most popular applications of computer graphics are less post-cinematic than some genres of contemporary film itself."
    }
  ],
  "fundEntries": [],
  "changeSummary": "Faithful structural package of authored The Uncanny Section 3; no prose changes and no initial fund entries."
}
