{
  "schemaVersion": 1,
  "workId": "plenitude",
  "sectionId": "great-divide",
  "sectionOrder": 1,
  "title": "The Great Divide",
  "editionId": "editorial-preview",
  "versionId": "great-divide-editorial-v001",
  "parentVersionId": null,
  "createdAt": "2026-09-22T00:00:00Z",
  "source": {
    "type": "authored",
    "path": "plenitude/source_texts/sections/section-1.md"
  },
  "spine": [
    {
      "id": "great-divide-p01",
      "markdown": "In 2013, the rapper Jay Z released a video called \"Picasso Baby: A Performance Art Film.\" The video documents a performance in an unusual venue, a \"white-box\" hall of the New York Pace Gallery. As he raps, Jay Z playfully confronts one by one a series of fans and \"art-world types,\" as the New York Times article describes them (Trebay 2013). Jay Z got the idea from a work by the performance artist, Marina Abramovic, who had in 2010 staged a 30-day event at the MOMA, in which she sat motionless and stared at one seated individual after other. Abramovic herself appears as one of Jay Z's partners. Director Mark Romanek's video portrays the joyful atmosphere of an event in which well-known art figures as well as the fans are delighted to be taking part. Jay Z begins: \"I just want a Picasso in my casa, no, my castle.\" His lyrics make reference to other twentieth-century artists (Rothko, Warhol, Basquiat, Francis Bacon), but there seems to be no particular rationale for his choices. Jay Z feels no weight of the elite artistic tradition of the twentieth century. His list includes those who functioned comfortably within the elite community and those who were challenging the status of art itself. At the end he intones: \"...I'm the modern day Pablo Picasso baby.\""
    },
    {
      "id": "great-divide-p02",
      "markdown": "The video includes a brief introductory interview in which Jay Z explains that he is bringing art and rap as popular culture back together. Despite the rather hostile tone of some of the lyrics, the point of the video is that Jay Z transcends the artificial barriers that separated high art from the life of everyday people, which rap is about. An artist Mickalene Thomas suggests a political dimension to this performance: \"For a young black man in America to be on his level of success and rapping about art, and not what he's wearing, is the coolest thing...\" Jay Z was indeed raised in a housing project in Brooklyn by his mother after being abandoned by his father and had early encounters with guns and drugs. And the video certainly intends to suggest his acceptance by the New York art community. The artist Marilyn Minter says that \"Jay-Z speaks to the times we live in.\""
    },
    {
      "id": "great-divide-p03",
      "markdown": "But what does his performance say about those times? What does it mean to be an artist today, and why does Jay Z want to portray himself as one? The video is supposed to celebrate the openness of our culture in which traditional art and rap come together, and it doubtless does that for millions of viewers. One fan, Keith Hunt, comments on the YouTube video:\n\n> \"...Rap is a complex and beautiful art form. And Jay Z is one of the best of all time in this medium. I don't see anything weird about one of the best artists in his medium sharing his art at an art gallery.\""
    },
    {
      "id": "great-divide-p04",
      "markdown": "Yet the video also provoked every conceivable reaction. Some regarded it as derivative or silly; others criticized it simply as poor rap (that is, they judged it by the standards and genres of the rap community). The video, the performance, the comments by fans and artists, the reactions in the press and online---all reflect the complex and uncertain status of art among the various communities of our media culture. The great division between elite art and popular culture has almost, but not quite, vanished. What replaces that division is not a consensus about art, but a wide range of different attitudes."
    }
  ],
  "fundEntries": [],
  "changeSummary": "Faithful structural package of authored Plenitude Section 1; no prose changes and no initial fund entries."
}
