{
  "schemaVersion": 1,
  "workId": "uncanny",
  "sectionId": "uncanny-avatars",
  "sectionOrder": 4,
  "title": "Uncanny Avatars in Mirror Worlds",
  "editionId": "editorial-preview",
  "versionId": "uncanny-avatars-editorial-v001",
  "parentVersionId": null,
  "createdAt": "2026-09-23T00:00:00Z",
  "source": {
    "type": "authored",
    "path": "uncanny/source_texts/sections/section-4.md"
  },
  "spine": [
    {
      "id": "uncanny-avatars-p01",
      "markdown": "The avatar is the uncanny double par excellence in digital media. The avatar is your visual persona as you engage in a digital video game or in a social media environment such as Meta's Horizon Worlds. It functions as a real-time extension of yourself, one which you can often style to suit your own fancy. Depending on the system and game world mechanics, you can speak, move, and interact with objects, non-player characters (NPCs) or, as is the case in massively multiplayer online games (MMOGs), other people's avatars. In particular, it is not surprising that NPCs as enemies in first-person shooter (FPS) games are often in the shape of zombies or aliens. They are uncanny doubles too. In the game, The Last of US and the VR game, Half Life Alyx, for example, such menacing uncanny doubles become the enemies that the player, through their avatar, are meant to destroy."
    },
    {
      "id": "uncanny-avatars-p02",
      "markdown": "There are in fact (at least) two kinds of doubles in computer games. The NPCs are the most obvious case of an uncanny double that stalks and haunts the virtual worlds. These AI-steered characters are often what the player interacts with and often seeks to destroy, although the NPCs are no less uncanny, when they are helpful to the player. The second double is the player in the virtual world, or rather the avatar that the player embodies with some part of their physical being, physiognomy, movements, and also intelligence and emotional capacities. At times, this double is fully realized with a CG body; at other times it is merely made up of a first-person point-of-view and hands."
    },
    {
      "id": "uncanny-avatars-p03",
      "markdown": "There are several VR applications and experiences – both in \"real\" Virtual Reality and 360° video – that also play with the doubling of avatars and the human, as a threshold between two worlds, or as a point of observation into a virtual/cinematic world. The immersive documentary On the Morning You Wake (to the End of the World) from 2022 uses audio interviews, real telephone calls from the day in question, and a series of animations, 360° video and CGI-rendered scenes. It is about when on Saturday 13 January 2018 at 8.07am every person on Hawaii received a text message from the country's emergency management agency. In this experience, we are not scanned into a system, nor do we choose an avatar. Instead, we are asked to witness the inhabitants of Hawaii and their stories of that day. The videos of them are treated with CGI rendering both humans and the natural setting eerie, other-worldly. Almost real, but not quite. This is not an endless metaverse, but rather a defined space and time. Nevertheless, VR documentaries of this sort are becoming increasingly common, and part of their aesthetic choices is often a play with the doubling that we discuss in this essay. The viewer is sometimes a bodiless set of eyes that can do nothing but observe yet can move around in the space. Sometimes, there is a set of hands, or parts of a body. At other times, a whole avatar who can be more or less human-like."
    },
    {
      "id": "uncanny-avatars-p04",
      "markdown": "In many VR systems, such as Meta Horizon Worlds, there are launch environments, CG places which you first encounter when you put on the headset. They can be a mountaintop cabin, on a planet far away, a fancy house in some exotic locale. These launching sites are often called homes, and they are places in which you take stock of your avatar, often by looking at a mirror. Then you can call up the avatar library through your interface features in the space and start customizing its appearance almost endlessly. These CG representations more often have a cartoonish character than a photorealistic one. Not thus far, but developments in photorealistic image capture for VR are rapidly progressing. At the time of writing this article, Meta has released the first showings of a photorealistic avatar system (Ma et al., 2023). In a podcast interview with Lex Fridman in September 2023, Mark Zuckerberg appeared in a photorealistic avatar shape that Meta calls pixel codec avatars (Ma et al, 2023). Fridman and Zuckerberg both appear as truncated floating figures in high resolution in the video-recorded interview as they meet inside a virtual environment, while actually sitting miles apart. Fridman suggests that the uncanny valley has been crossed, and Zuckerberg agrees although he also admits there remains fine-tuning to do when it comes to emotiveness of the avatars. Zuckerberg says \"It does feel like you; it doesn't feel weird or anything like that\" although their avatars actually are made up of their faces and parts of their torso, without hands, or any other part of their bodies, suspended in a black space. Fridman repeats throughout his interview: \"this is incredible. The realism here is just incredible\" (Zuckerberg 2023). With their repeated and performative comments on the realism of this experience, they are aligning VR with the most traditional form of cinematic realism. They insist on its uncanniness but are in fact implying that the hesitation has been resolved, the uncanny valley had been crossed."
    },
    {
      "id": "uncanny-avatars-p05",
      "markdown": "Such avatars are the citizens of the prospective metaverse, and nothing seems less uncanny and at the same time more ironic than Zuckerberg's vision of the metaverse as a mirror world. Perhaps the only uncanny statement in the Fridman interview is Zuckerberg's offhand remark: \"We want to get more people scanned and into the system\" (Zuckerberg 2023). Unlike the subterranean and eerie mirror world in US, Zuckerberg's metaverse is an endlessly open space that simultaneously merges with our physical world (through AR and MR technologies) and expands it, often metaphorically and visually into a virtual space. The avatar and the metaverse as doubles are not concealed and certainly not primal in any Freudian sense. For the enthusiasts of the metaverse, this level of doubling is simply the technological and design challenge of this moment in the history of CG."
    },
    {
      "id": "uncanny-avatars-p06",
      "markdown": "We have not addressed a defining element of the experience of the mirror worlds of VR: the way in which embodiment is staged. VR is immersive in a way different from the immersion of cinema and engages the kinesthetic and proprioceptive senses in a different way, as many theorists, including contributors to this volume (e.g. Ceuterick; Chan), have noted. While, in this essay, we are focusing on the visual dimension of VR, grounded in computer graphics, we do not mean to underestimate the techniques and technologies that are coordinated with computer graphics and make possible VR immersion and kinesthetic responses possible. VR is not the first medium to stage a kind of embodiment; the argument has long been made that the experience of cinema is embodied too. It is rather that VR embodiment is different in that the scene is adjusted in real time in response to changes in orientation and position, and this technical difference suggests a new kind of immersive spectatorship. The point we wish to emphasize is that this embodiment does not raise VR beyond the realm of mediation. (Despite the utopian claims of some enthusiasts, VR is still a representational medium in the tradition of photography and film.) Rather it opens a new gap parallel to the visual gap that we have been exploring—this one between a particular mediation of embodied vision and the embodiment that we experience when we take off the headset. Ceuterick articulates this gap when she notes that VR is always an \"oscillation between content, the device and a potentially distracting physical environment forms an integral part of what virtual reality spectatorship is.\" In other words, VR embodiment fashions its own uncanny valley, or we could say that the uncanny valley of VR embodied spectatorship is multimodal. In either case, the La Ciotat effect is still operative. VR embodiment does not erase the uncanny quality of the experience; it adds another dimension to the uncanny."
    }
  ],
  "fundEntries": [],
  "changeSummary": "Faithful structural package of authored The Uncanny Section 4; no prose changes and no initial fund entries."
}
